1,Fri Jan 03 2020 17:16:27 GMT-0800 (Pacific Standard Time),Id maxime ex qui ab alias est.,1,1
2,Fri Jan 03 2020 10:57:53 GMT-0800 (Pacific Standard Time),In et eligendi eligendi quod autem.,1,1
3,Fri Jan 03 2020 14:01:15 GMT-0800 (Pacific Standard Time),Exercitationem voluptatem et error error et.,1,1
4,Fri Jan 03 2020 00:56:43 GMT-0800 (Pacific Standard Time),Dolores dolorum sit ipsum.,1,3
5,Fri Jan 03 2020 08:32:16 GMT-0800 (Pacific Standard Time),Voluptates non facere corrupti velit voluptas ipsa pariatur neque.,1,1
6,Fri Jan 03 2020 00:35:24 GMT-0800 (Pacific Standard Time),Veniam sunt libero rerum voluptates excepturi possimus sunt.,1,1
7,Fri Jan 03 2020 04:05:33 GMT-0800 (Pacific Standard Time),Perspiciatis adipisci corporis cum est.,2,3
8,Fri Jan 03 2020 14:43:40 GMT-0800 (Pacific Standard Time),Deleniti rerum cumque qui itaque.,2,2
9,Fri Jan 03 2020 16:51:40 GMT-0800 (Pacific Standard Time),Ducimus quo et praesentium aut rerum architecto suscipit velit consequatur.,2,2
10,Thu Jan 02 2020 18:14:43 GMT-0800 (Pacific Standard Time),Ut ut aut quos aut est.,2,3
11,Thu Jan 02 2020 23:14:16 GMT-0800 (Pacific Standard Time),Eos nesciunt consequatur et odit vitae non nihil.,2,3
12,Thu Jan 02 2020 17:59:18 GMT-0800 (Pacific Standard Time),Aut repellat modi numquam.,2,2
13,Fri Jan 03 2020 02:52:41 GMT-0800 (Pacific Standard Time),Quod beatae ipsam ut cum.,2,1
14,Thu Jan 02 2020 23:42:08 GMT-0800 (Pacific Standard Time),Eveniet consequuntur molestias totam nemo illum et.,3,1
15,Thu Jan 02 2020 18:01:19 GMT-0800 (Pacific Standard Time),Eveniet sit dignissimos tempore pariatur harum.,3,3
16,Thu Jan 02 2020 20:04:15 GMT-0800 (Pacific Standard Time),Odit facere commodi eveniet.,3,2
17,Fri Jan 03 2020 04:25:43 GMT-0800 (Pacific Standard Time),Consequuntur incidunt quod enim rerum quaerat ipsam voluptatem sint.,3,1
18,Fri Jan 03 2020 04:07:13 GMT-0800 (Pacific Standard Time),Omnis aut dolores fuga sed dolor libero eaque.,3,3
19,Thu Jan 02 2020 18:43:34 GMT-0800 (Pacific Standard Time),Et vitae sint.,4,3
20,Thu Jan 02 2020 17:39:07 GMT-0800 (Pacific Standard Time),Rerum laboriosam nihil odio aliquid quo et veniam tempore.,4,3
21,Fri Jan 03 2020 08:27:01 GMT-0800 (Pacific Standard Time),Aut minima nobis.,4,3
22,Fri Jan 03 2020 06:03:57 GMT-0800 (Pacific Standard Time),Ut est rem numquam quasi itaque mollitia vel.,4,1
23,Fri Jan 03 2020 16:05:51 GMT-0800 (Pacific Standard Time),Illo a eos.,5,2
24,Thu Jan 02 2020 22:58:19 GMT-0800 (Pacific Standard Time),Quae sit sunt voluptatem dolorem dolorem itaque voluptatem.,5,3
25,Fri Jan 03 2020 14:13:27 GMT-0800 (Pacific Standard Time),Non qui rerum molestiae ea reprehenderit.,5,1
26,Fri Jan 03 2020 11:23:34 GMT-0800 (Pacific Standard Time),Dolorem atque non aut ut hic assumenda.,5,1
27,Fri Jan 03 2020 08:53:52 GMT-0800 (Pacific Standard Time),Eligendi odit excepturi tenetur pariatur autem possimus quia.,6,3
28,Thu Jan 02 2020 20:12:19 GMT-0800 (Pacific Standard Time),Dolorem similique ut dolores dolore tenetur excepturi est.,6,3
29,Thu Jan 02 2020 19:46:54 GMT-0800 (Pacific Standard Time),Deserunt aut vitae.,6,3
30,Thu Jan 02 2020 22:34:14 GMT-0800 (Pacific Standard Time),Maiores eligendi fuga rem ut ut libero pariatur.,6,2
31,Fri Jan 03 2020 04:11:20 GMT-0800 (Pacific Standard Time),Cumque quae debitis sequi culpa harum recusandae consequatur omnis.,7,2
32,Fri Jan 03 2020 07:07:05 GMT-0800 (Pacific Standard Time),Qui corporis praesentium quibusdam ipsum optio in natus at.,7,3
33,Fri Jan 03 2020 07:35:36 GMT-0800 (Pacific Standard Time),Dolorum at ullam inventore qui tenetur consequatur repellat placeat accusamus.,7,1
34,Fri Jan 03 2020 15:09:42 GMT-0800 (Pacific Standard Time),Quos ut nam rerum fugiat odio molestiae ut.,7,1
35,Thu Jan 02 2020 18:23:36 GMT-0800 (Pacific Standard Time),A perferendis explicabo sed dicta molestias velit necessitatibus cum dolore.,7,2
36,Fri Jan 03 2020 16:09:26 GMT-0800 (Pacific Standard Time),Voluptatem ullam officiis.,8,3
37,Fri Jan 03 2020 14:59:07 GMT-0800 (Pacific Standard Time),Tempore amet odio.,8,1
38,Fri Jan 03 2020 13:21:16 GMT-0800 (Pacific Standard Time),Eveniet quam pariatur aspernatur consequatur sed alias.,8,2
39,Fri Jan 03 2020 02:27:24 GMT-0800 (Pacific Standard Time),Molestiae autem eum laborum libero.,8,3
40,Thu Jan 02 2020 20:49:10 GMT-0800 (Pacific Standard Time),Ut accusamus esse tempora debitis facere magnam et.,8,3
41,Fri Jan 03 2020 10:53:19 GMT-0800 (Pacific Standard Time),Qui quos architecto officiis maiores harum et et.,8,1
42,Fri Jan 03 2020 16:36:08 GMT-0800 (Pacific Standard Time),Et ut quis alias doloribus rerum.,8,3
43,Thu Jan 02 2020 18:27:45 GMT-0800 (Pacific Standard Time),Consequuntur non sint voluptas.,9,1
44,Fri Jan 03 2020 16:12:42 GMT-0800 (Pacific Standard Time),Sint et et natus.,9,1
45,Fri Jan 03 2020 02:36:20 GMT-0800 (Pacific Standard Time),Et exercitationem quasi illo.,9,2
46,Thu Jan 02 2020 23:38:39 GMT-0800 (Pacific Standard Time),Reprehenderit quo qui.,9,1
47,Thu Jan 02 2020 20:39:23 GMT-0800 (Pacific Standard Time),Animi aut quia aliquid id.,9,2
48,Fri Jan 03 2020 16:35:39 GMT-0800 (Pacific Standard Time),Cum quis iusto saepe est voluptatem.,10,3
49,Thu Jan 02 2020 20:16:24 GMT-0800 (Pacific Standard Time),Fuga non nihil.,10,2
50,Fri Jan 03 2020 08:06:42 GMT-0800 (Pacific Standard Time),Nostrum asperiores nostrum dolores debitis accusantium.,10,1
51,Fri Jan 03 2020 09:38:48 GMT-0800 (Pacific Standard Time),Et alias nisi provident velit vel suscipit magni aliquid.,10,2
52,Thu Jan 02 2020 19:22:51 GMT-0800 (Pacific Standard Time),Ut sit expedita nulla.,10,2
53,Fri Jan 03 2020 13:44:54 GMT-0800 (Pacific Standard Time),Quod cupiditate aut odit nihil vel voluptatibus.,10,1
